{
  "concept": "cow",
  "type": "connectDots",
  "level": 1,
  "viewBox": "0 0 150 150",
  "dots": [
    {
      "n": 1,
      "cx": 34,
      "cy": 63
    },
    {
      "n": 2,
      "cx": 24,
      "cy": 55
    },
    {
      "n": 3,
      "cx": 14,
      "cy": 49
    },
    {
      "n": 4,
      "cx": 17,
      "cy": 37
    },
    {
      "n": 5,
      "cx": 29,
      "cy": 38
    },
    {
      "n": 6,
      "cx": 40,
      "cy": 43
    },
    {
      "n": 7,
      "cx": 42,
      "cy": 31
    },
    {
      "n": 8,
      "cx": 42,
      "cy": 19
    },
    {
      "n": 9,
      "cx": 53,
      "cy": 23
    },
    {
      "n": 10,
      "cx": 46,
      "cy": 9
    },
    {
      "n": 11,
      "cx": 54,
      "cy": 24
    },
    {
      "n": 12,
      "cx": 46,
      "cy": 9
    },
    {
      "n": 13,
      "cx": 55,
      "cy": 25
    },
    {
      "n": 14,
      "cx": 49,
      "cy": 13
    },
    {
      "n": 15,
      "cx": 55,
      "cy": 26
    }
  ],
  "guides": [],
  "outline": [
    {
      "cx": 34,
      "cy": 63
    },
    {
      "cx": 34,
      "cy": 63
    },
    {
      "cx": 34,
      "cy": 63
    },
    {
      "cx": 34,
      "cy": 62
    },
    {
      "cx": 34,
      "cy": 62
    },
    {
      "cx": 34,
      "cy": 62
    },
    {
      "cx": 34,
      "cy": 61
    },
    {
      "cx": 34,
      "cy": 61
    },
    {
      "cx": 34,
      "cy": 61
    },
    {
      "cx": 34,
      "cy": 61
    },
    {
      "cx": 34,
      "cy": 60
    },
    {
      "cx": 34,
      "cy": 60
    },
    {
      "cx": 34,
      "cy": 60
    },
    {
      "cx": 34,
      "cy": 59
    },
    {
      "cx": 34,
      "cy": 59
    },
    {
      "cx": 34,
      "cy": 59
    },
    {
      "cx": 34,
      "cy": 59
    },
    {
      "cx": 34,
      "cy": 58
    },
    {
      "cx": 34,
      "cy": 58
    },
    {
      "cx": 32,
      "cy": 58
    },
    {
      "cx": 32,
      "cy": 58
    },
    {
      "cx": 33,
      "cy": 58
    },
    {
      "cx": 31,
      "cy": 57
    },
    {
      "cx": 33,
      "cy": 58
    },
    {
      "cx": 31,
      "cy": 57
    },
    {
      "cx": 33,
      "cy": 58
    },
    {
      "cx": 31,
      "cy": 57
    },
    {
      "cx": 29,
      "cy": 57
    },
    {
      "cx": 34,
      "cy": 58
    },
    {
      "cx": 32,
      "cy": 57
    },
    {
      "cx": 29,
      "cy": 57
    },
    {
      "cx": 30,
      "cy": 57
    },
    {
      "cx": 32,
      "cy": 57
    },
    {
      "cx": 34,
      "cy": 58
    },
    {
      "cx": 30,
      "cy": 57
    },
    {
      "cx": 28,
      "cy": 57
    },
    {
      "cx": 30,
      "cy": 57
    },
    {
      "cx": 29,
      "cy": 57
    },
    {
      "cx": 29,
      "cy": 57
    },
    {
      "cx": 27,
      "cy": 56
    },
    {
      "cx": 27,
      "cy": 56
    },
    {
      "cx": 28,
      "cy": 56
    },
    {
      "cx": 28,
      "cy": 56
    },
    {
      "cx": 26,
      "cy": 56
    },
    {
      "cx": 26,
      "cy": 56
    },
    {
      "cx": 27,
      "cy": 56
    },
    {
      "cx": 26,
      "cy": 56
    },
    {
      "cx": 26,
      "cy": 56
    },
    {
      "cx": 25,
      "cy": 56
    },
    {
      "cx": 25,
      "cy": 56
    },
    {
      "cx": 24,
      "cy": 55
    },
    {
      "cx": 24,
      "cy": 55
    },
    {
      "cx": 25,
      "cy": 55
    },
    {
      "cx": 23,
      "cy": 55
    },
    {
      "cx": 24,
      "cy": 55
    },
    {
      "cx": 23,
      "cy": 55
    },
    {
      "cx": 23,
      "cy": 55
    },
    {
      "cx": 22,
      "cy": 54
    },
    {
      "cx": 23,
      "cy": 54
    },
    {
      "cx": 22,
      "cy": 54
    },
    {
      "cx": 22,
      "cy": 54
    },
    {
      "cx": 21,
      "cy": 54
    },
    {
      "cx": 21,
      "cy": 54
    },
    {
      "cx": 20,
      "cy": 53
    },
    {
      "cx": 21,
      "cy": 53
    },
    {
      "cx": 20,
      "cy": 53
    },
    {
      "cx": 20,
      "cy": 53
    },
    {
      "cx": 20,
      "cy": 53
    },
    {
      "cx": 19,
      "cy": 53
    },
    {
      "cx": 19,
      "cy": 52
    },
    {
      "cx": 19,
      "cy": 52
    },
    {
      "cx": 18,
      "cy": 52
    },
    {
      "cx": 18,
      "cy": 52
    },
    {
      "cx": 18,
      "cy": 52
    },
    {
      "cx": 17,
      "cy": 51
    },
    {
      "cx": 17,
      "cy": 51
    },
    {
      "cx": 17,
      "cy": 51
    },
    {
      "cx": 17,
      "cy": 51
    },
    {
      "cx": 16,
      "cy": 50
    },
    {
      "cx": 16,
      "cy": 50
    },
    {
      "cx": 16,
      "cy": 50
    },
    {
      "cx": 15,
      "cy": 50
    },
    {
      "cx": 15,
      "cy": 50
    },
    {
      "cx": 15,
      "cy": 49
    },
    {
      "cx": 14,
      "cy": 49
    },
    {
      "cx": 14,
      "cy": 49
    },
    {
      "cx": 14,
      "cy": 49
    },
    {
      "cx": 14,
      "cy": 48
    },
    {
      "cx": 13,
      "cy": 48
    },
    {
      "cx": 13,
      "cy": 48
    },
    {
      "cx": 13,
      "cy": 47
    },
    {
      "cx": 12,
      "cy": 47
    },
    {
      "cx": 12,
      "cy": 47
    },
    {
      "cx": 12,
      "cy": 47
    },
    {
      "cx": 12,
      "cy": 46
    },
    {
      "cx": 11,
      "cy": 46
    },
    {
      "cx": 11,
      "cy": 46
    },
    {
      "cx": 11,
      "cy": 45
    },
    {
      "cx": 11,
      "cy": 45
    },
    {
      "cx": 10,
      "cy": 45
    },
    {
      "cx": 10,
      "cy": 44
    },
    {
      "cx": 10,
      "cy": 44
    },
    {
      "cx": 10,
      "cy": 44
    },
    {
      "cx": 10,
      "cy": 44
    },
    {
      "cx": 9,
      "cy": 43
    },
    {
      "cx": 9,
      "cy": 43
    },
    {
      "cx": 9,
      "cy": 43
    },
    {
      "cx": 9,
      "cy": 42
    },
    {
      "cx": 9,
      "cy": 42
    },
    {
      "cx": 9,
      "cy": 42
    },
    {
      "cx": 9,
      "cy": 41
    },
    {
      "cx": 9,
      "cy": 41
    },
    {
      "cx": 9,
      "cy": 41
    },
    {
      "cx": 9,
      "cy": 41
    },
    {
      "cx": 9,
      "cy": 40
    },
    {
      "cx": 9,
      "cy": 40
    },
    {
      "cx": 9,
      "cy": 40
    },
    {
      "cx": 10,
      "cy": 39
    },
    {
      "cx": 10,
      "cy": 39
    },
    {
      "cx": 10,
      "cy": 39
    },
    {
      "cx": 11,
      "cy": 39
    },
    {
      "cx": 11,
      "cy": 39
    },
    {
      "cx": 11,
      "cy": 38
    },
    {
      "cx": 11,
      "cy": 38
    },
    {
      "cx": 12,
      "cy": 38
    },
    {
      "cx": 12,
      "cy": 38
    },
    {
      "cx": 12,
      "cy": 38
    },
    {
      "cx": 13,
      "cy": 38
    },
    {
      "cx": 13,
      "cy": 38
    },
    {
      "cx": 13,
      "cy": 38
    },
    {
      "cx": 14,
      "cy": 38
    },
    {
      "cx": 14,
      "cy": 38
    },
    {
      "cx": 14,
      "cy": 38
    },
    {
      "cx": 14,
      "cy": 37
    },
    {
      "cx": 15,
      "cy": 37
    },
    {
      "cx": 15,
      "cy": 37
    },
    {
      "cx": 15,
      "cy": 37
    },
    {
      "cx": 16,
      "cy": 37
    },
    {
      "cx": 16,
      "cy": 37
    },
    {
      "cx": 16,
      "cy": 37
    },
    {
      "cx": 17,
      "cy": 37
    },
    {
      "cx": 17,
      "cy": 37
    },
    {
      "cx": 17,
      "cy": 37
    },
    {
      "cx": 17,
      "cy": 37
    },
    {
      "cx": 18,
      "cy": 37
    },
    {
      "cx": 18,
      "cy": 37
    },
    {
      "cx": 18,
      "cy": 37
    },
    {
      "cx": 19,
      "cy": 37
    },
    {
      "cx": 19,
      "cy": 37
    },
    {
      "cx": 19,
      "cy": 37
    },
    {
      "cx": 20,
      "cy": 37
    },
    {
      "cx": 20,
      "cy": 37
    },
    {
      "cx": 20,
      "cy": 37
    },
    {
      "cx": 20,
      "cy": 37
    },
    {
      "cx": 21,
      "cy": 37
    },
    {
      "cx": 21,
      "cy": 37
    },
    {
      "cx": 21,
      "cy": 37
    },
    {
      "cx": 22,
      "cy": 37
    },
    {
      "cx": 22,
      "cy": 37
    },
    {
      "cx": 22,
      "cy": 37
    },
    {
      "cx": 23,
      "cy": 37
    },
    {
      "cx": 23,
      "cy": 37
    },
    {
      "cx": 23,
      "cy": 37
    },
    {
      "cx": 24,
      "cy": 37
    },
    {
      "cx": 23,
      "cy": 37
    },
    {
      "cx": 24,
      "cy": 37
    },
    {
      "cx": 24,
      "cy": 37
    },
    {
      "cx": 25,
      "cy": 37
    },
    {
      "cx": 25,
      "cy": 37
    },
    {
      "cx": 25,
      "cy": 37
    },
    {
      "cx": 26,
      "cy": 37
    },
    {
      "cx": 26,
      "cy": 37
    },
    {
      "cx": 26,
      "cy": 37
    },
    {
      "cx": 26,
      "cy": 37
    },
    {
      "cx": 27,
      "cy": 37
    },
    {
      "cx": 27,
      "cy": 37
    },
    {
      "cx": 28,
      "cy": 38
    },
    {
      "cx": 27,
      "cy": 37
    },
    {
      "cx": 28,
      "cy": 38
    },
    {
      "cx": 28,
      "cy": 38
    },
    {
      "cx": 29,
      "cy": 38
    },
    {
      "cx": 29,
      "cy": 38
    },
    {
      "cx": 29,
      "cy": 38
    },
    {
      "cx": 29,
      "cy": 38
    },
    {
      "cx": 30,
      "cy": 38
    },
    {
      "cx": 30,
      "cy": 38
    },
    {
      "cx": 30,
      "cy": 38
    },
    {
      "cx": 31,
      "cy": 38
    },
    {
      "cx": 31,
      "cy": 38
    },
    {
      "cx": 31,
      "cy": 38
    },
    {
      "cx": 32,
      "cy": 39
    },
    {
      "cx": 32,
      "cy": 38
    },
    {
      "cx": 32,
      "cy": 39
    },
    {
      "cx": 33,
      "cy": 39
    },
    {
      "cx": 33,
      "cy": 39
    },
    {
      "cx": 39,
      "cy": 43
    },
    {
      "cx": 34,
      "cy": 40
    },
    {
      "cx": 32,
      "cy": 39
    },
    {
      "cx": 40,
      "cy": 43
    },
    {
      "cx": 35,
      "cy": 40
    }
  ],